title,description,content,publishedAt,url,source,topic,date,clean_text,sentiment_gemini,sentiment_score
Today in Apple history: Siri debuts on iPhone 4s,"On October 4, 2011, Apple introduced the world to its intelligent voice assistant. The Siri launch marked the culmination of a long-term goal.
(via Cult of Mac - Your source for the latest Apple news, rumors, analysis, reviews, how-tos and deals.)","October 4, 2011: With the unveiling of the iPhone 4s, Apple introduces the world to Siri. A groundbreaking example of artificial intelligence in action, the Siri launch fulfills a long-term dream at … [+5309 chars]",2025-10-04T15:01:15Z,https://www.cultofmac.com/apple-history/siri-launch-iphone-4s,Cult of Mac,Artificial Intelligence,2025-10-04,"Today in Apple history: Siri debuts on iPhone 4s On October 4, 2011, Apple introduced the world to its intelligent voice assistant. The Siri launch marked the culmination of a long-term goal.via Cult of Mac - Your source for the latest Apple news, rumors, analysis, reviews, how-tos and deals.",Neutral,0.0
"About 25% of US adults say they use AI chatbots like ChatGPT for news, and 33% of them say they generally find it difficult to tell what is true and what is not (Pew Research Center)","Pew Research Center:
About 25% of US adults say they use AI chatbots like ChatGPT for news, and 33% of them say they generally find it difficult to tell what is true and what is not  —  A growing share of Americans are using artificial intelligence chatbots l…","Mediagazer presents the day's must-read media news on a single page.
The media business is in tumult: from the production side to
the distribution side, new technologies are upending the industry.… [+416 chars]",2025-10-04T15:00:01Z,https://mediagazer.com/251004/p1,Mediagazer.com,Artificial Intelligence,2025-10-04,"About 25 of US adults say they use AI chatbots like ChatGPT for news, and 33 of them say they generally find it difficult to tell what is true and what is not Pew Research Center Pew Research Center:About 25 of US adults say they use AI chatbots like ChatGPT for news, and 33 of them say they generally find it difficult to tell what is true and what is not A growing share of Americans are using artificial intelligence chatbots l",Neutral,0.0
Surges 14.3% on Partnership with AI Giant,"We recently published 10 Stocks With Eye-Popping Double-Digit Gains. Rumble Inc. (NASDAQ:RUM) is one of the top performers on Friday.
Rumble Inc. rallied for a third straight day on Friday, jumping 14.31 percent to close at $25.96 apiece after it partnered wi…","We recently published 10 Stocks With Eye-Popping Double-Digit Gains. Rumble Inc. (NASDAQ:RUM) is one of the top performers on Friday.Rumble Inc. rallied for a third straight day on Friday, jumping 14… [+148 chars]",2025-10-04T14:56:18Z,https://biztoc.com/x/73b76612636eb041,Biztoc.com,Artificial Intelligence,2025-10-04,"Surges 14.3 on Partnership with AI Giant We recently published 10 Stocks With Eye-Popping Double-Digit Gains. Rumble Inc. NASDAQ:RUM is one of the top performers on Friday.Rumble Inc. rallied for a third straight day on Friday, jumping 14.31 percent to close at 25.96 apiece after it partnered wi",Neutral,0.0
The U.S. is about to hold the government’s biggest coal sales in over a decade even as demand wanes. ‘Eventually coal will get pushed out of the market’,“Eventually coal will get pushed out of the market. The economics will just eat the coal generation over time.”,"U.S. officials in the coming days are set to hold the governments biggest coal sales in more than a decade, offering 600 million tons from publicly owned reserves next to strip mines in Montana and W… [+7042 chars]",2025-10-04T14:51:19Z,https://fortune.com/2025/10/04/us-government-biggest-coal-sales-decade-demand-mining-fossil-fuel-natural-gas/,Fortune,Artificial Intelligence,2025-10-04,The U.S. is about to hold the governments biggest coal sales in over a decade even as demand wanes. Eventually coal will get pushed out of the market Eventually coal will get pushed out of the market. The economics will just eat the coal generation over time.,Neutral,0.0
ABC Biography of #59 Sarah (Cutter) Knapp (1785-1878) of New Jersey,,"Using the ABC method described in Using Artificial Intelligence In the Ancestor Biography Creation (ABC) Process, here is another ancestor biography using the Anthropic Claude Sonnet 4 AI tool.1) I w… [+14028 chars]",2025-10-04T14:50:00Z,https://www.blogger.com/comment/fullpage/post/26204193/5085608740347517727,Blogger.com,Artificial Intelligence,2025-10-04,ABC Biography of Sarah Cutter Knapp 1785-1878 of New Jersey,Neutral,0.0
Could First Majestic Silver's $12 Stock Be a Backdoor AI Play?,"Key Points
-
OpenAI CEO Sam Altman has warned that ""an energy breakthrough"" is needed to meet the artificial intelligence (AI) revolution's global energy needs.
-
With governments committed to decarbonization, much of this new power will come from nuclear ene…","Key Points-OpenAI CEO Sam Altman has warned that ""an energy breakthrough"" is needed to meet the artificial intelligence (AI) revolution's global energy needs.-With governments committed to decarboniz… [+136 chars]",2025-10-04T14:45:20Z,https://biztoc.com/x/688d3302f6516511,Biztoc.com,Artificial Intelligence,2025-10-04,"Could First Majestic Silver's 12 Stock Be a Backdoor AI Play? Key Points-OpenAI CEO Sam Altman has warned that an energy breakthrough is needed to meet the artificial intelligence AI revolution's global energy needs.-With governments committed to decarbonization, much of this new power will come from nuclear ene",Neutral,0.0
TSLA Crashes 10% AGAIN—But $70¢ Earnings & FSD 14 and $35K Model to the Rescue,Despite a 10% dip after strong Q3 delivery numbers (the stock remains up 29% for the month. How low can Tesla shares go? Why could shares rebound ? FSD v14 release or Model Q announcement. Robotaxi Expansion: Texas regulations require an urgent response team …,Brian Wang is a Futurist Thought Leader and a popular Science blogger with 1 million readers per month. His blog Nextbigfuture.com is ranked #1 Science News Blog. It covers many disruptive technology… [+593 chars],2025-10-04T14:43:47Z,https://www.nextbigfuture.com/2025/10/tsla-crashes-10-again-but-70%c2%a2-earnings-fsd-14-and-35k-model-to-the-rescue.html,Next Big Future,Artificial Intelligence,2025-10-04,TSLA Crashes 10 AGAINBut 70 Earnings FSD 14 and 35K Model to the Rescue Despite a 10 dip after strong Q3 delivery numbers the stock remains up 29 for the month. How low can Tesla shares go? Why could shares rebound ? FSD v14 release or Model Q announcement. Robotaxi Expansion: Texas regulations require an urgent response team,Neutral,0.0
[Eugene Volokh] Court Especially Concerned About Hallucinations in Criminal Defense Lawyer's Filings,"From California Court of Appeal Justice Judith McConnell, writing for the court Thursday in People v. Alvarez; the lawyer involved...","From California Court of Appeal Justice Judith McConnell, writing for the court Thursday in People v. Alvarez; the lawyer involved has been licensed in California for 54 years:
[A filing in this cas… [+3491 chars]",2025-10-04T14:37:45Z,https://reason.com/volokh/2025/10/04/court-especially-concerned-about-hallucinations-in-criminal-defense-lawyers-filings/,Reason,Artificial Intelligence,2025-10-04,"Eugene Volokh Court Especially Concerned About Hallucinations in Criminal Defense Lawyer's Filings From California Court of Appeal Justice Judith McConnell, writing for the court Thursday in People v. Alvarez; the lawyer involved...",Neutral,0.0
Rumble Inc. (RUM) Surges 14.3% on Partnership with AI Giant,We recently published 10 Stocks With Eye-Popping Double-Digit Gains. Rumble Inc. (NASDAQ:RUM) is one of the top performers on Friday. Rumble Inc. rallied for...,"We recently published 10 Stocks With Eye-Popping Double-Digit Gains. Rumble Inc. (NASDAQ:RUM) is one of the top performers on Friday.
Rumble Inc. rallied for a third straight day on Friday, jumping … [+1885 chars]",2025-10-04T14:32:59Z,https://finance.yahoo.com/news/rumble-inc-rum-surges-14-143259832.html,Yahoo Entertainment,Artificial Intelligence,2025-10-04,Rumble Inc. RUM Surges 14.3 on Partnership with AI Giant We recently published 10 Stocks With Eye-Popping Double-Digit Gains. Rumble Inc. NASDAQ:RUM is one of the top performers on Friday. Rumble Inc. rallied for...,Neutral,0.0
DC’s shutdown hasn't stopped the stock market. Here’s what may,The U.S. stock market continues to rise despite the government's latest shutdown. The S&P 500 and Dow Jones Industrial Average hit all-time highs on Friday. It's not just big tech driving the market; the Russell 2000 index of smaller stocks and gold also reac…,"NEW YORK (AP) If the U.S. governments latest shutdown cant stop the stock market, what can? 
Stock prices keep rising, even as the shutdown delays important economic reports that usually steer tradi… [+5350 chars]",2025-10-04T14:29:28Z,https://apnews.com/article/stock-market-rates-records-shutdown-earnings-ai-251fefd075ac658ce498c9d1953efc70,Associated Press,Artificial Intelligence,2025-10-04,DCs shutdown hasn't stopped the stock market. Heres what may The U.S. stock market continues to rise despite the government's latest shutdown. The SP 500 and Dow Jones Industrial Average hit all-time highs on Friday. It's not just big tech driving the market; the Russell 2000 index of smaller stocks and gold also reac,Neutral,0.0
The Rock’s MOVIE FLOPS!!! Earns $6M and BUDGET was $70M,"THE ROCK’S NEW MOVIE FLOPS HARD — COULD THIS BE THE END OF HOLLYWOOD’S LAST TRUE MOVIE STAR? Dwayne “The Rock” Johnson has built his career — and his empire — on being unstoppable. But this weekend, the box office told a very different story. His new film, Th…","THE ROCKS NEW MOVIE FLOPS HARD COULD THIS BE THE END OF HOLLYWOODS LAST TRUE MOVIE STAR?
Dwayne The Rock Johnson has built his career and his empire on being unstoppable. But this weekend, the box o… [+3410 chars]",2025-10-04T14:50:16Z,https://mediatakeout.com/the-rocks-movie-flops-earns-6m-and-budget-was-70m/,Mediatakeout.com,Machine Learning,2025-10-04,"The Rocks MOVIE FLOPS!!! Earns 6M and BUDGET was 70M THE ROCKS NEW MOVIE FLOPS HARD COULD THIS BE THE END OF HOLLYWOODS LAST TRUE MOVIE STAR? Dwayne The Rock Johnson has built his career and his empire on being unstoppable. But this weekend, the box office told a very different story. His new film,Th",Neutral,0.0
You're using AI more than you realize: Here's how it powers your everyday tasks,"AI can be used for a lot of boring, mundane things because it does a great job at them. You're using it right now!","(Image credit: Future)
One of the web's longest-running tech columns, Android &amp; Chill is your Saturday discussion of Android, Google, and all things tech.
AI is often a fatigue-inducing buzzwor… [+5518 chars]",2025-10-04T14:48:00Z,https://www.androidcentral.com/apps-software/ai/youre-using-ai-all-the-time-and-might-not-even-know-it,Android Central,Machine Learning,2025-10-04,"You're using AI more than you realize: Here's how it powers your everyday tasks AI can be used for a lot of boring, mundane things because it does a great job at them. You're using it right now!",Neutral,0.0
Autonomous combat aircraft unveiled as Europe’s loyal wingman,"Autonomous fighter planes are popping up all over the place these days as more air forces opt for pilotless loyal wingmen. The latest example is Europe's version, the multi-role Helsing CA-1 Europa, which has just made its public debut.Continue ReadingTags: A…","Autonomous fighter planes are popping up all over the place these days as more air forces opt for pilotless loyal wingmen. The latest example is Europe's version, the multi-role Helsing CA-1 Europa, … [+2896 chars]",2025-10-04T14:03:00Z,https://newatlas.com/ca-1-europa-loyal-wingman/,New Atlas,Machine Learning,2025-10-04,"Autonomous combat aircraft unveiled as Europes loyal wingman Autonomous fighter planes are popping up all over the place these days as more air forces opt for pilotless loyal wingmen. The latest example is Europe's version, the multi-role Helsing CA-1 Europa, which has just made its public debut.Continue ReadingTags: A",Neutral,0.0
nqxpack 0.1.7,"Library to serialise objects arising from scientific and Machine Learning libraries, including NetKet.","A required part of this site couldnt load. This may be due to a browser
 extension, network issues, or browser settings. Please check your
 connection, disable any ad blockers, or try using a diffe… [+12 chars]",2025-10-04T13:51:20Z,https://pypi.org/project/nqxpack/0.1.7/,Pypi.org,Machine Learning,2025-10-04,"nqxpack 0.1.7 Library to serialise objects arising from scientific and Machine Learning libraries, including NetKet.",Neutral,0.0
"At 58, Tom Cillo is tackling his dream of playing college football","Despite the physical and financial risks, a 58-year-old Lycoming College freshman is determined to succeed. He balances school, football, and caring for his mother.","WILLIAMSPORT, Pa. The shouts of Yeah, Tom! started the moment Tom Cillo crossed the white paint on the sideline and stepped onto the field at Girardi Stadium.
After a couple of bounces to expend som… [+22430 chars]",2025-10-04T13:30:00Z,https://www.stltoday.com/sports/college/football/article_44453d3d-842c-51c8-875e-5cf8cc37893f.html,STLtoday.com,Machine Learning,2025-10-04,"At 58, Tom Cillo is tackling his dream of playing college football Despite the physical and financial risks, a 58-year-old Lycoming College freshman is determined to succeed. He balances school, football, and caring for his mother.",Neutral,0.0
Show HN: Unstable Singularity Detector,"### Why I built- Earlier this year, DeepMind published groundbreaking work on detecting unstablesingularities in fluid dynamics—one of the deepest open problems in mathematicalphysics (arXiv:2509.14185).- The challenge? No public code.
- Extreme numerical pre…","Independent re-implementation of unstable singularity detection methods inspired by DeepMind research
Based on the paper ""Discovering new solutions to century-old problems in fluid dynamics"" (blog p… [+21708 chars]",2025-10-04T12:15:15Z,https://github.com/Flamehaven/unstable-singularity-detector,Github.com,Machine Learning,2025-10-04,"Show HN: Unstable Singularity Detector Why I built- Earlier this year, DeepMind published groundbreaking work on detecting unstablesingularities in fluid dynamicsone of the deepest open problems in mathematicalphysics arXiv:2509.14185.- The challenge? No public code.- Extreme numerical pre",Neutral,0.0
The One UI 8.5 leaks that has us most excited about the Samsung Galaxy S26,"We analyze One UI 8.5 leaks and what they reveal about the Galaxy S26, plus news of Handoff coming to Android & a new Pixel Watch feature.","00:00 Mishaal Rahman: The floodgates have opened for One UI 8.5 leaks, giving us an early glimpse of the software features that will arrive on the Samsung Galaxy S26.
00:08 C. Scott Brown: And Googl… [+55325 chars]",2025-10-04T12:00:16Z,https://www.androidauthority.com/authority-insights-podcast-007-3603279/,Android Authority,Machine Learning,2025-10-04,"The One UI 8.5 leaks that has us most excited about the Samsung Galaxy S26 We analyze One UI 8.5 leaks and what they reveal about the Galaxy S26, plus news of Handoff coming to Android a new Pixel Watch feature.",Neutral,0.0
Apple Glasses Rumored For Next Year With These Features,"The Apple Glasses are coming next year, according to rumors, and it will bring new features for users who'll purchase to enjoy.","The main priority of Apple now is its upcoming Apple Glasses that have been rumored for release next year.
The Apple Glasses is said to be an AI-first device, with the machine learning technology be… [+2060 chars]",2025-10-04T11:30:20Z,https://www.ibtimes.com/apple-glasses-rumored-next-year-these-features-3785562,International Business Times,Machine Learning,2025-10-04,"Apple Glasses Rumored For Next Year With These Features The Apple Glasses are coming next year, according to rumors, and it will bring new features for users who'll purchase to enjoy.",Neutral,0.0
dragon-ml-toolbox 10.2.1,A collection of tools for data science and machine learning projects.,"A required part of this site couldnt load. This may be due to a browser
 extension, network issues, or browser settings. Please check your
 connection, disable any ad blockers, or try using a diffe… [+12 chars]",2025-10-04T11:25:40Z,https://pypi.org/project/dragon-ml-toolbox/10.2.1/,Pypi.org,Machine Learning,2025-10-04,dragon-ml-toolbox 10.2.1 A collection of tools for data science and machine learning projects.,Neutral,0.0
"Despite AI-related job loss fears, tech hiring holds steady - and here are the most in-demand skills","Two recent surveys, from ManpowerGroup and UpWork, show optimism for tech-related hiring for both jobs and gigs, now and into the remainder of the quarter.","NeoLeo/iStock / Getty Images Plus
Follow ZDNET: Add us as a preferred source on Google.
ZDNET's key takeaways
<ul><li>Tech hiring for the next quarter is steady compared to a year ago.</li><li>AI … [+5774 chars]",2025-10-04T10:00:32Z,https://www.zdnet.com/article/despite-ai-related-job-loss-fears-tech-hiring-holds-steady-and-here-are-the-most-in-demand-skills/,ZDNet,Machine Learning,2025-10-04,"Despite AI-related job loss fears, tech hiring holds steady - and here are the most in-demand skills Two recent surveys, from ManpowerGroup and UpWork, show optimism for tech-related hiring for both jobs and gigs, now and into the remainder of the quarter.",Neutral,0.0
