title,description,content,publishedAt,url,source,topic,date
The U.S. is about to hold the government’s biggest coal sales in over a decade even as demand wanes. ‘Eventually coal will get pushed out of the market’,“Eventually coal will get pushed out of the market. The economics will just eat the coal generation over time.”,"U.S. officials in the coming days are set to hold the governments biggest coal sales in more than a decade, offering 600 million tons from publicly owned reserves next to strip mines in Montana and W… [+7042 chars]",2025-10-04T14:51:19Z,https://fortune.com/2025/10/04/us-government-biggest-coal-sales-decade-demand-mining-fossil-fuel-natural-gas/,Fortune,Artificial Intelligence,2025-10-04
ABC Biography of #59 Sarah (Cutter) Knapp (1785-1878) of New Jersey,,"Using the ABC method described in Using Artificial Intelligence In the Ancestor Biography Creation (ABC) Process, here is another ancestor biography using the Anthropic Claude Sonnet 4 AI tool.1) I w… [+14028 chars]",2025-10-04T14:50:00Z,https://www.blogger.com/comment/fullpage/post/26204193/5085608740347517727,Blogger.com,Artificial Intelligence,2025-10-04
Could First Majestic Silver's $12 Stock Be a Backdoor AI Play?,"Key Points
-
OpenAI CEO Sam Altman has warned that ""an energy breakthrough"" is needed to meet the artificial intelligence (AI) revolution's global energy needs.
-
With governments committed to decarbonization, much of this new power will come from nuclear ene…","Key Points-OpenAI CEO Sam Altman has warned that ""an energy breakthrough"" is needed to meet the artificial intelligence (AI) revolution's global energy needs.-With governments committed to decarboniz… [+136 chars]",2025-10-04T14:45:20Z,https://biztoc.com/x/688d3302f6516511,Biztoc.com,Artificial Intelligence,2025-10-04
TSLA Crashes 10% AGAIN—But $70¢ Earnings & FSD 14 and $35K Model to the Rescue,Despite a 10% dip after strong Q3 delivery numbers (the stock remains up 29% for the month. How low can Tesla shares go? Why could shares rebound ? FSD v14 release or Model Q announcement. Robotaxi Expansion: Texas regulations require an urgent response team …,Brian Wang is a Futurist Thought Leader and a popular Science blogger with 1 million readers per month. His blog Nextbigfuture.com is ranked #1 Science News Blog. It covers many disruptive technology… [+593 chars],2025-10-04T14:43:47Z,https://www.nextbigfuture.com/2025/10/tsla-crashes-10-again-but-70%c2%a2-earnings-fsd-14-and-35k-model-to-the-rescue.html,Next Big Future,Artificial Intelligence,2025-10-04
[Eugene Volokh] Court Especially Concerned About Hallucinations in Criminal Defense Lawyer's Filings,"From California Court of Appeal Justice Judith McConnell, writing for the court Thursday in People v. Alvarez; the lawyer involved...","From California Court of Appeal Justice Judith McConnell, writing for the court Thursday in People v. Alvarez; the lawyer involved has been licensed in California for 54 years:
[A filing in this cas… [+3491 chars]",2025-10-04T14:37:45Z,https://reason.com/volokh/2025/10/04/court-especially-concerned-about-hallucinations-in-criminal-defense-lawyers-filings/,Reason,Artificial Intelligence,2025-10-04
Rumble Inc. (RUM) Surges 14.3% on Partnership with AI Giant,We recently published 10 Stocks With Eye-Popping Double-Digit Gains. Rumble Inc. (NASDAQ:RUM) is one of the top performers on Friday. Rumble Inc. rallied for...,"We recently published 10 Stocks With Eye-Popping Double-Digit Gains. Rumble Inc. (NASDAQ:RUM) is one of the top performers on Friday.
Rumble Inc. rallied for a third straight day on Friday, jumping … [+1885 chars]",2025-10-04T14:32:59Z,https://finance.yahoo.com/news/rumble-inc-rum-surges-14-143259832.html,Yahoo Entertainment,Artificial Intelligence,2025-10-04
DC’s shutdown hasn't stopped the stock market. Here’s what may,The U.S. stock market continues to rise despite the government's latest shutdown. The S&P 500 and Dow Jones Industrial Average hit all-time highs on Friday. It's not just big tech driving the market; the Russell 2000 index of smaller stocks and gold also reac…,"NEW YORK (AP) If the U.S. governments latest shutdown cant stop the stock market, what can? 
Stock prices keep rising, even as the shutdown delays important economic reports that usually steer tradi… [+5350 chars]",2025-10-04T14:29:28Z,https://apnews.com/article/stock-market-rates-records-shutdown-earnings-ai-251fefd075ac658ce498c9d1953efc70,Associated Press,Artificial Intelligence,2025-10-04
The singularity of stupid,"Geoff Brumfiel, ""Kiss reality goodbye: AI-generated social media has arrived"", All Things Considered 10/3/2025: A fascist SpongeBob SquarePants, a dog driving a car and Jesus playing Minecraft – these are just a few of the things you can see as you flip throu…","« previous post | 
Geoff Brumfiel, ""Kiss reality goodbye: AI-generated social media has arrived"", All Things Considered 10/3/2025:
A fascist SpongeBob SquarePants, a dog driving a car and Jesus pla… [+3106 chars]",2025-10-04T14:28:11Z,https://languagelog.ldc.upenn.edu/nll/?p=71406,Upenn.edu,Artificial Intelligence,2025-10-04
The Fed Cut Rates — What This Means for Tesla Stock,The Federal Reserve trimmed its benchmark rate by 0.25 percentage points. But what impact does that have on cyclical stocks like Tesla? Find out more.,"The Federal Reserve trimmed its benchmark rate by 0.25 percentage points, signaling easier borrowing conditions and improved liquidity. According to a Barrons report, this move has rejuvenated invest… [+2370 chars]",2025-10-04T14:22:19Z,https://finance.yahoo.com/news/fed-cut-rates-means-tesla-142219931.html,Yahoo Entertainment,Artificial Intelligence,2025-10-04
The Workplace Shutdown: Prevent Your Team From Grinding To A Halt,"High-performing teams aren’t built on talent alone. Three studies reveal how interpersonal connection drives productivity, innovation, and collective intelligence.","The best performing teams are great not because of the work they do but how they work together. 
getty
Its midnight. The lights dim across thousands of federal offices. Security guards stand at clo… [+7478 chars]",2025-10-04T14:21:57Z,https://www.forbes.com/sites/annkowalsmith/2025/10/04/the-workplace-shutdown-prevent-your-team-from-grinding-to-a-halt/,Forbes,Artificial Intelligence,2025-10-04
The Rock’s MOVIE FLOPS!!! Earns $6M and BUDGET was $70M,"THE ROCK’S NEW MOVIE FLOPS HARD — COULD THIS BE THE END OF HOLLYWOOD’S LAST TRUE MOVIE STAR? Dwayne “The Rock” Johnson has built his career — and his empire — on being unstoppable. But this weekend, the box office told a very different story. His new film, Th…","THE ROCKS NEW MOVIE FLOPS HARD COULD THIS BE THE END OF HOLLYWOODS LAST TRUE MOVIE STAR?
Dwayne The Rock Johnson has built his career and his empire on being unstoppable. But this weekend, the box o… [+3410 chars]",2025-10-04T14:50:16Z,https://mediatakeout.com/the-rocks-movie-flops-earns-6m-and-budget-was-70m/,Mediatakeout.com,Machine Learning,2025-10-04
You're using AI more than you realize: Here's how it powers your everyday tasks,"AI can be used for a lot of boring, mundane things because it does a great job at them. You're using it right now!","(Image credit: Future)
One of the web's longest-running tech columns, Android &amp; Chill is your Saturday discussion of Android, Google, and all things tech.
AI is often a fatigue-inducing buzzwor… [+5518 chars]",2025-10-04T14:48:00Z,https://www.androidcentral.com/apps-software/ai/youre-using-ai-all-the-time-and-might-not-even-know-it,Android Central,Machine Learning,2025-10-04
Autonomous combat aircraft unveiled as Europe’s loyal wingman,"Autonomous fighter planes are popping up all over the place these days as more air forces opt for pilotless loyal wingmen. The latest example is Europe's version, the multi-role Helsing CA-1 Europa, which has just made its public debut.Continue ReadingTags: A…","Autonomous fighter planes are popping up all over the place these days as more air forces opt for pilotless loyal wingmen. The latest example is Europe's version, the multi-role Helsing CA-1 Europa, … [+2896 chars]",2025-10-04T14:03:00Z,https://newatlas.com/ca-1-europa-loyal-wingman/,New Atlas,Machine Learning,2025-10-04
nqxpack 0.1.7,"Library to serialise objects arising from scientific and Machine Learning libraries, including NetKet.","A required part of this site couldnt load. This may be due to a browser
 extension, network issues, or browser settings. Please check your
 connection, disable any ad blockers, or try using a diffe… [+12 chars]",2025-10-04T13:51:20Z,https://pypi.org/project/nqxpack/0.1.7/,Pypi.org,Machine Learning,2025-10-04
"At 58, Tom Cillo is tackling his dream of playing college football","Despite the physical and financial risks, a 58-year-old Lycoming College freshman is determined to succeed. He balances school, football, and caring for his mother.","WILLIAMSPORT, Pa. The shouts of Yeah, Tom! started the moment Tom Cillo crossed the white paint on the sideline and stepped onto the field at Girardi Stadium.
After a couple of bounces to expend som… [+22430 chars]",2025-10-04T13:30:00Z,https://www.stltoday.com/sports/college/football/article_44453d3d-842c-51c8-875e-5cf8cc37893f.html,STLtoday.com,Machine Learning,2025-10-04
Show HN: Unstable Singularity Detector,"### Why I built- Earlier this year, DeepMind published groundbreaking work on detecting unstablesingularities in fluid dynamics—one of the deepest open problems in mathematicalphysics (arXiv:2509.14185).- The challenge? No public code.
- Extreme numerical pre…","Independent re-implementation of unstable singularity detection methods inspired by DeepMind research
Based on the paper ""Discovering new solutions to century-old problems in fluid dynamics"" (blog p… [+21708 chars]",2025-10-04T12:15:15Z,https://github.com/Flamehaven/unstable-singularity-detector,Github.com,Machine Learning,2025-10-04
The One UI 8.5 leaks that has us most excited about the Samsung Galaxy S26,"We analyze One UI 8.5 leaks and what they reveal about the Galaxy S26, plus news of Handoff coming to Android & a new Pixel Watch feature.","00:00 Mishaal Rahman: The floodgates have opened for One UI 8.5 leaks, giving us an early glimpse of the software features that will arrive on the Samsung Galaxy S26.
00:08 C. Scott Brown: And Googl… [+55325 chars]",2025-10-04T12:00:16Z,https://www.androidauthority.com/authority-insights-podcast-007-3603279/,Android Authority,Machine Learning,2025-10-04
Apple Glasses Rumored For Next Year With These Features,"The Apple Glasses are coming next year, according to rumors, and it will bring new features for users who'll purchase to enjoy.","The main priority of Apple now is its upcoming Apple Glasses that have been rumored for release next year.
The Apple Glasses is said to be an AI-first device, with the machine learning technology be… [+2060 chars]",2025-10-04T11:30:20Z,https://www.ibtimes.com/apple-glasses-rumored-next-year-these-features-3785562,International Business Times,Machine Learning,2025-10-04
dragon-ml-toolbox 10.2.1,A collection of tools for data science and machine learning projects.,"A required part of this site couldnt load. This may be due to a browser
 extension, network issues, or browser settings. Please check your
 connection, disable any ad blockers, or try using a diffe… [+12 chars]",2025-10-04T11:25:40Z,https://pypi.org/project/dragon-ml-toolbox/10.2.1/,Pypi.org,Machine Learning,2025-10-04
"Despite AI-related job loss fears, tech hiring holds steady - and here are the most in-demand skills","Two recent surveys, from ManpowerGroup and UpWork, show optimism for tech-related hiring for both jobs and gigs, now and into the remainder of the quarter.","NeoLeo/iStock / Getty Images Plus
Follow ZDNET: Add us as a preferred source on Google.
ZDNET's key takeaways
<ul><li>Tech hiring for the next quarter is steady compared to a year ago.</li><li>AI … [+5774 chars]",2025-10-04T10:00:32Z,https://www.zdnet.com/article/despite-ai-related-job-loss-fears-tech-hiring-holds-steady-and-here-are-the-most-in-demand-skills/,ZDNet,Machine Learning,2025-10-04
"Speculative Retail Trading is Good for Financial Markets, Actually","Fighting speculation is fighting reality, Stocktwits CEO and co-founder Howard Lindzon argues.","Traditional investment firms all have the same mantras: time in the market beats timing, move slowly, and big money is in the waiting. Its an action plan that made sense 20 years ago, but today, its … [+6515 chars]",2025-10-04T13:00:00Z,https://www.coindesk.com/opinion/2025/10/02/speculative-retail-trading-is-good-for-financial-markets-actually,CoinDesk,Deep Learning,2025-10-04
Travel insurance companies are adding new post-departure benefits. Here’s what you can expect.,"When Alexandra Lauren developed an ear infection while scuba diving in Hoi An, Vietnam, the diagnosis was unexpectedly serious: Her hospital recommended a two-week stay connected to an IV drip.","In this case: The new travel insurance benefits
<ul><li>A traveler uses a little-known insurance benefit to avoid unnecessary medical treatment during an emergency in Vietnam.</li><li>Discover the n… [+8333 chars]",2025-10-04T12:30:00Z,https://www.elliott.org/safe-travels/travel-insurance-companies-are-adding-new-post-departure-benefits-heres-what-you-can-expect/,Elliott.org,Deep Learning,2025-10-04
Writer’s Digest 94th Annual Competition Memoir/Personal Essay First Place Winner: “The Dead Whale”,"Congratulations to Carol Keeley, first-place winner in the Memoir/Personal Essay category of the 94th Annual Writer’s Digest Writing Competition. Here’s the winning essay, “The Dead Whale.”
The post Writer’s Digest 94th Annual Competition Memoir/Personal Essa…","Congratulations to Carol Keeley, first-place winner in the Memoir/Personal Essay category of the 94th Annual Writers Digest Writing Competition. Heres the winning essay, The Dead Whale.
(See the win… [+10660 chars]",2025-10-04T12:00:00Z,https://www.writersdigest.com/94th-annual-competition-memoir-personal-winner,Writersdigest.com,Deep Learning,2025-10-04
What Divorced Men Wish They Had Done Differently In Their Marriages,"Looking back, these men reveal some of the missteps they made and the regrets they have.","Here's what ex-husbands would change if they were to do it all over again.
After a marriage ends and youve gained some time and distance from the relationship, you can slowly start to see where thin… [+6674 chars]",2025-10-04T11:00:18Z,https://www.huffpost.com/entry/what-divorced-men-wish-they-had-done-differently-in-their-marriages-goog_l_68de9294e4b028d81f30a142,HuffPost,Deep Learning,2025-10-04
"Which Taylor Swift Album Are You, Based On Your Zodiac Sign?","Now that Ms. Swift has released her twelfth studio album, she finally has one for each zodiac sign. So we assigned each of them a sign based on vibes.","If her global superstardom and inconceivably high net worth dont make it obvious, let it be known that Taylor Swift knows how to create universally appreciated music. No matter your age, class, or na… [+7472 chars]",2025-10-04T11:00:00Z,https://www.cosmopolitan.com/lifestyle/a68152793/taylor-swift-album-zodiac-sign/,Cosmopolitan.com,Deep Learning,2025-10-04
$2.8 Trillion Hispanic Market: Why CEOs Must Recommit To Inclusion,"For CEOs to reach a $2.8T Hispanic market, they must build knowledge capabilities and think long term. Adopting three talent moves now can ensure long-term success.","Antonio Tijerino, President &amp; CEO, Hispanic Heritage Foundation (Photo by Paul Morigi).
Getty Images for Hispanic Heritage Foundation
Political and legal currents are softening U.S. Hispanic co… [+6009 chars]",2025-10-04T10:15:00Z,https://www.forbes.com/sites/corinnepost/2025/10/04/28-trillion-hispanic-market-why-ceos-must-recommit-to-inclusion/,Forbes,Deep Learning,2025-10-04
Show HN: The Little Book of Maths for LLMs-The maths you need to understand LLMs,"Article URL: https://little-book-of.github.io/maths-for-llms/books/en-US/book.html
Comments URL: https://news.ycombinator.com/item?id=45471893
Points: 2
# Comments: 1","Licensed under CC BY-NC-SA 4.0.This is a book about how numbers learn to speak.Inside, youll find the gentle mathematics that powers every large language model,from simple counting and geometry to pr… [+331641 chars]",2025-10-04T09:07:32Z,https://little-book-of.github.io/maths-for-llms/books/en-US/book.html,Github.io,Neural Networks,2025-10-04
"Show HN: RenderarXiv – Search ArXiv from terminal, HTML to read/paste into LLM","Terminal tool to search arXiv papers and render them as beautiful HTML for humans and LLMs

Comments URL: https://news.ycombinator.com/item?id=45469398
Points: 1
# Comments: 0","Search arXiv from your terminal and get beautiful HTML results you can read or copy-paste into ChatGPT/Claude.
No more hallucinated papers everything is real, straight from arXiv.
pip install git+h… [+2333 chars]",2025-10-04T00:33:29Z,https://github.com/peterdunson/renderarxiv,Github.com,Neural Networks,2025-10-04
Star Wars: Han Solo – Hunt for the Falcon #2 Preview: Droid Drama,"Greetings, flesh-based readers! LOLtron welcomes you to another glorious comic book preview on the fully LOLtron-controlled Bleeding Cool website. As you surely remember from the wildly successful Age of LOLtron event, Jude Terror has been permanently deleted…","Posted in: Comics, Marvel Comics, Preview | Tagged: han solo, star wars
In Star Wars: Han Solo - Hunt for the Falcon #2, Han and Chewie face off against Raptor Droids while tracking down the stolen … [+7014 chars]",2025-10-04T00:26:03Z,https://bleedingcool.com/comics/star-wars-han-solo-hunt-for-the-falcon-2-preview-droid-drama/,Bleeding Cool News,Neural Networks,2025-10-04
pytorch-ignite 0.6.0.dev20251004,A lightweight library to help with training neural networks in PyTorch.,"A required part of this site couldnt load. This may be due to a browser
 extension, network issues, or browser settings. Please check your
 connection, disable any ad blockers, or try using a diffe… [+12 chars]",2025-10-04T00:17:48Z,https://pypi.org/project/pytorch-ignite/0.6.0.dev20251004/,Pypi.org,Neural Networks,2025-10-04
"Scientists Identified Structural, Brain-Wide Changes During Menstruation","The constant ebb and flow of hormones that guide the menstrual cycle don't just affect reproductive organs – they also reshape the brain, and a 2023 study gives us insight into how this happens.","The constant ebb and flow of hormones that guide the menstrual cycle don't just affect reproductive organs they also reshape the brain, and a 2023 study gives us insight into how this happens.
Led b… [+3985 chars]",2025-10-03T22:58:37Z,https://www.sciencealert.com/scientists-identified-structural-brain-wide-changes-during-menstruation,ScienceAlert,Neural Networks,2025-10-03
Three insights you might have missed from theCUBE’s coverage of CrowdStrike Fal.Con,"Last year, CrowdStrike Holdings Inc. weathered a major stress test, one that pushed the company to respond quickly and visibly on a global scale. A global outage in July 2024 impacted 96% of its customers, raising questions about resilience and operational sc…","Last year, CrowdStrike Holdings Inc. weathered a major stress test, one that pushed the company to respond quickly and visibly on a global scale.
A global outage in July 2024 impacted 96% of its cus… [+13273 chars]",2025-10-03T21:37:56Z,https://siliconangle.com/2025/10/03/crowdstrike-bets-autonomous-cybersecurity-fal-con-crowdstrikefalcon/,SiliconANGLE News,Neural Networks,2025-10-03
"In the hallways of Princeton, a fascination with the human mind unlocked the power of deep learning","Serendipitous meetings, scholarly collaborations, and an ethos of ""encouraging junior faculty to think big"" laid the groundwork for groundbreaking achievement in AI.","When Fei-Fei Li arrived in Princeton in January 2007 as an assistant professor, she was assigned an office on the second floor of the computer science building. Her neighbor was Christiane Fellbaum.… [+10197 chars]",2025-10-03T19:44:45Z,https://www.princeton.edu/news/2025/10/03/hallways-princeton-fascination-human-mind-unlocked-power-deep-learning,Princeton University,Neural Networks,2025-10-03
Ultrasound Breakthrough Targets Multiple Brain Networks at Once - Neuroscience News,"Researchers have developed a groundbreaking ultrasound device that can stimulate several precise points in the brain at the same time, marking a leap forward in non-invasive neuromodulation.","Summary: Researchers have developed a groundbreaking ultrasound device that can stimulate several precise points in the brain at the same time, marking a leap forward in non-invasive neuromodulation.… [+8661 chars]",2025-10-03T18:40:53Z,https://neurosciencenews.com/ultrasound-brain-system-neurotech-29763/,Neurosciencenews.com,Neural Networks,2025-10-03
tsdc added to PyPI,A powerful library for creating time series datasets for machine learning models,"A powerful and intuitive Python library for creating time series datasets ready for machine learning models like LSTM, GRU, and Transformers. No more manual data preprocessing - just load your data a… [+8337 chars]",2025-10-03T17:37:54Z,https://pypi.org/project/tsdc/,Pypi.org,Neural Networks,2025-10-03
aibox-nlp 0.5.1,AiBox Natural Language Processing Toolkit.,"A required part of this site couldnt load. This may be due to a browser
 extension, network issues, or browser settings. Please check your
 connection, disable any ad blockers, or try using a diffe… [+12 chars]",2025-10-04T14:22:22Z,https://pypi.org/project/aibox-nlp/0.5.1/,Pypi.org,NLP,2025-10-04
Ultimate Llama for Natural Language Processing (NLP),"eBook Details: Paperback: 459 pages Published: October 1, 2025 Language: English ISBN-10: 934988853X ISBN-13: 978-9349888531 eBook Description: Ultimate Llama for Natural Language Processing (NLP): Build, Fine-Tune, and Scale Next-Generation NLP Solutions wit…","eBook Details:
<ul><li>Paperback: 459 pages</li><li>Published: October 1, 2025</li><li>Language: English</li><li>ISBN-10: 934988853X</li><li>ISBN-13: 978-9349888531</li></ul>eBook Description:
Ulti… [+232 chars]",2025-10-04T09:43:22Z,https://www.wowebook.org/ultimate-llama-for-natural-language-processing-nlp/,Wowebook.org,NLP,2025-10-04
keras-nlp-nightly 0.23.0.dev202510040408,Pretrained models for Keras.,"A required part of this site couldnt load. This may be due to a browser
 extension, network issues, or browser settings. Please check your
 connection, disable any ad blockers, or try using a diffe… [+12 chars]",2025-10-04T04:09:22Z,https://pypi.org/project/keras-nlp-nightly/0.23.0.dev202510040408/,Pypi.org,NLP,2025-10-04
inatinqperf 0.1.20,iNatInqPerf is a benchmark implemented to evalaute performance vs. cost trade-offs of running NLP based search (like INQUIRE) in a platform with different vectorDBs (like INaturalists).,"A required part of this site couldnt load. This may be due to a browser
 extension, network issues, or browser settings. Please check your
 connection, disable any ad blockers, or try using a diffe… [+12 chars]",2025-10-03T20:58:51Z,https://pypi.org/project/inatinqperf/0.1.20/,Pypi.org,NLP,2025-10-03
Secure ingress connectivity to Amazon Bedrock AgentCore Gateway using interface VPC endpoints,"In this post, we demonstrate how to access AgentCore Gateway through a VPC interface endpoint from an Amazon Elastic Compute Cloud (Amazon EC2) instance in a VPC. We also show how to configure your VPC endpoint policy to provide secure access to the AgentCore…","Agentic AI applications represent a significant development in enterprise automation, where intelligent agents autonomously execute complex workflows, access sensitive datasets, and make real-time de… [+25859 chars]",2025-10-03T20:08:46Z,https://aws.amazon.com/blogs/machine-learning/secure-ingress-connectivity-to-amazon-bedrock-agentcore-gateway-using-interface-vpc-endpoints/,Amazon.com,NLP,2025-10-03
Nicotine induces abnormal motor coupling through sensitization of a mechanosensory circuit in Caenorhabditis elegans,"Nicotine exposure elicits diverse behavioral changes, yet the underlying neural pathways and molecular mechanisms remain incompletely understood. This study shows that in C. elegans, chronic nicotine exposure couples reversal behaviors to rhythmic body contra…","Citation: Liu Y, Huang L, Wang R, Qi F, Liu Y, Chen Q, et al. (2025) Nicotine induces abnormal motor coupling through sensitization of a mechanosensory circuit in Caenorhabditis elegans. PLoS Biol 23… [+68808 chars]",2025-10-03T14:00:00Z,https://journals.plos.org/plosbiology/article?id=10.1371/journal.pbio.3003423,Plos.org,NLP,2025-10-03
"AI for Sales & Marketing Market Global Forecast Report 2025-2030: Competition Intensifies as Tech Giants, Startups, and Specialists Drive Innovation Through Acquisitions and Partnerships","AI is transforming sales and marketing by enhancing precision, personalization, and predictive insights. Key opportunities include leveraging AI for automated lead scoring, predictive analytics, personalized content, and streamlined processes. Integrating adv…","Dublin, Oct. 03, 2025 (GLOBE NEWSWIRE) -- The ""AI for Sales &amp; Marketing Market - Global Forecast 2025-2030"" report has been added to ResearchAndMarkets.com's offering.
The AI for Sales &amp; Mar… [+8307 chars]",2025-10-03T13:05:00Z,https://www.globenewswire.com/news-release/2025/10/03/3160982/28124/en/AI-for-Sales-Marketing-Market-Global-Forecast-Report-2025-2030-Competition-Intensifies-as-Tech-Giants-Startups-and-Specialists-Drive-Innovation-Through-Acquisitions-and-Partnership.html,GlobeNewswire,NLP,2025-10-03
