title,description,content,publishedAt,url,source,topic,date
"Optimize Production with PyTorch/TF, ONNX, TensorRT & LiteRT","Learn how to optimize and deploy AI models efficiently across PyTorch, TensorFlow, ONNX, TensorRT, and LiteRT for faster production workflows.","Introduction



Machine learning frameworks, model tools, and deployment strategies have distinct use cases in a machine learning (ML) pipeline. They can exhibit strengths and weaknesses in each st… [+34557 chars]",2025-10-03T07:32:00Z,https://www.digitalocean.com/community/tutorials/ai-model-deployment-optimization,Digitalocean.com,NLP,2025-10-03
Huawei Ascend 950 vs Nvidia H200 vs AMD MI300 Instinct: How do they compare?,"Different compute platform philosophies emerge as Ascend 950 targets low-precision efficiency, H200 leverages ecosystem maturity, and MI300 dominates memory bandwidth and FP64 performance.",<ul><li>Huawei Ascend 950DT FP8 formats target efficient inference without accuracy loss</li><li>Nvidia H200 leans on a mature software ecosystem and Hopper GPU strengths</li><li>AMD Instinct MI300’s… [+7972 chars],2025-10-04T14:02:00Z,https://www.techradar.com/pro/huawei-ascend-950-vs-nvidia-h200-vs-amd-mi300-instinct-how-do-they-compare,TechRadar,Generative AI,2025-10-04
The AI Working Group: Capturing the Promise of AI,"Generative AI (GenAI) productivity is driving the US stock market to record highs in spite of the economic headwinds from tariffs, layoffs and immigration problems. This reflects the tremendous productivity benefits that GenAI promises. But there are challeng…","Generative AI (GenAI) productivity is driving the US stock market to record highs in spite of the economic headwinds from tariffs, layoffs and immigration problems. This reflects the tremendous produ… [+16057 chars]",2025-10-04T14:01:19Z,https://www.fairobserver.com/business/technology/the-ai-working-group-capturing-the-promise-of-ai/,Fair Observer,Generative AI,2025-10-04
"Sextortion scams against teen boys skyrocket after COVID, watchdog says",Callahan Walsh of NCMEC warns that financial sextortion targeting teenage boys has reached unprecedented levels since COVID with devastating consequences.,"DENVER - The National Center for Missing &amp; Exploited Children (NCMEC) is sounding the alarm over a surge in financial sextortion schemes that are targeting teenage boys at unprecedented levels, o… [+6755 chars]",2025-10-04T14:00:41Z,https://www.foxnews.com/us/sextortion-scams-against-teen-boys-skyrocket-after-covid-watchdog-says,Fox News,Generative AI,2025-10-04
This Week’s Awesome Tech Stories From Around the Web (Through October 4),"Every week, we scour the web for important, insightful, and fascinating stories in science and technology. These are our latest picks.
The post This Week’s Awesome Tech Stories From Around the Web (Through October 4) appeared first on SingularityHub.","OpenAIs New Video App Is Jaw-Dropping (for Better and Worse)Mike Isaac and Eli Tan | The New York Times ($)
""After we spent less than a day with the app, what became clear to us was that Sora had go… [+6144 chars]",2025-10-04T14:00:00Z,https://singularityhub.com/2025/10/04/this-weeks-awesome-tech-stories-from-around-the-web-through-october-4/,Singularity Hub,Generative AI,2025-10-04
"On Truth Social, Trump has embraced AI media to attack foes and boost his image","Not long before midnight on Thursday, with the government shutdown underway, President Donald Trump posted a video to Truth Social of himself in the Oval Office appearing to throw one of his red hats onto someone’s head as the Village People’s “Y.M.C.A.”","Not long before midnight on Thursday, with the government shutdown underway, President Donald Trump posted a video to Truth Social of himself in the Oval Office appearing to throw one of his red hats… [+11502 chars]",2025-10-04T13:34:00Z,https://www.nbcnews.com/tech/internet/truth-social-trump-embraced-ai-media-attack-foes-boost-image-rcna234978,NBC News,Generative AI,2025-10-04
Meta VP: AI is the best thing in advertising – if we use it right,"I worked in the ad industry for two decades, and every marketer and brand at Cannes Lions is actively exploring how to partner and invest the right way.","The global economy is undergoing a profound transformation, with one topic dominating executive suites and boardroom discussions: artificial intelligence (AI). AI is no longer a distant concept; its … [+4602 chars]",2025-10-04T13:10:00Z,https://fortune.com/2025/10/04/meta-vp-ai-is-the-best-thing-in-advertising-if-we-use-it-right/,Fortune,Generative AI,2025-10-04
Meta VP: AI is the best thing in advertising – if we use it right,"I worked in the ad industry for two decades, and every marketer and brand at Cannes Lions is actively exploring how to partner and invest the right way.","The global economy is undergoing a profound transformation, with one topic dominating executive suites and boardroom discussions: artificial intelligence (AI). AI is no longer a distant concept; its … [+4652 chars]",2025-10-04T13:10:00Z,https://finance.yahoo.com/news/meta-vp-ai-best-thing-131000643.html,Yahoo Entertainment,Generative AI,2025-10-04
fabriq 0.2.9.3,"Fabriq is a Python SDK for developing quick, low code Generative AI solutions.","A required part of this site couldnt load. This may be due to a browser
 extension, network issues, or browser settings. Please check your
 connection, disable any ad blockers, or try using a diffe… [+12 chars]",2025-10-04T13:01:43Z,https://pypi.org/project/fabriq/0.2.9.3/,Pypi.org,Generative AI,2025-10-04
fabriq 0.2.9.2,"Fabriq is a Python SDK for developing quick, low code, and enterprise-level Generative AI solutions.","A required part of this site couldnt load. This may be due to a browser
 extension, network issues, or browser settings. Please check your
 connection, disable any ad blockers, or try using a diffe… [+12 chars]",2025-10-04T12:24:31Z,https://pypi.org/project/fabriq/0.2.9.2/,Pypi.org,Generative AI,2025-10-04
10 Medieval Inventions So Advanced We Still Can't Beat Them [22:54],1:40 The heavy plough. 3:02 Eyeglasses. 4:28 Rotating three-field system. 6:02 Windmill post. 7:31 Magnetic compass. 9:00 Trebuchet. 11:10 Flying buttress. 13:13 Astrolabe. 15:15 Clockwork. 18:09 Gothic rose window. 10 Medieval Inventions So Advanced We Still…,1:40 The heavy plough. 3:02 Eyeglasses. 4:28 Rotating three-field system. 6:02 Windmill post. 7:31 Magnetic compass. 9:00 Trebuchet. 11:10 Flying buttress. 13:13 Astrolabe. 15:15 Clockwork. 18:09 Got… [+13657 chars],2025-10-04T14:14:01Z,https://freerepublic.com/focus/f-chat/4344301/posts,Freerepublic.com,Computer Vision,2025-10-04
McClellan: Community standards when cruelty is cool,Bill McClellan writes: Words have lost whatever shock value they once had. We’re conditioned to coarseness and tough talk.,"Several months ago, I think I joined Facebook.
I struggle now to remember exactly why. Maybe I wanted to see something on someones Facebook page and my wife was out of town, so I decided to set up m… [+6641 chars]",2025-10-04T12:00:00Z,https://www.stltoday.com/news/local/column/bill-mcclellan/article_def3f0fc-9a20-46cd-bcea-70886655dc61.html,STLtoday.com,Computer Vision,2025-10-04
Rail Vision (NASDAQ:RVSN) Raised to “Hold” at Wall Street Zen,"Wall Street Zen upgraded shares of Rail Vision (NASDAQ:RVSN – Free Report) to a hold rating in a research report released on Friday morning. Separately, Weiss Ratings reaffirmed a “sell (e+)” rating on shares of Rail Vision in a research note on Saturday, Sep…","Wall Street Zen upgraded shares of Rail Vision (NASDAQ:RVSN – Free Report) to a hold rating in a research report released on Friday morning.
Separately, Weiss Ratings reaffirmed a “sell (e+)” rating… [+2024 chars]",2025-10-04T07:49:09Z,https://www.etfdailynews.com/2025/10/04/rail-vision-nasdaqrvsn-raised-to-hold-at-wall-street-zen/,ETF Daily News,Computer Vision,2025-10-04
HTML4Vision 0.6.1,A simple HTML visualization tool for computer vision research,"A required part of this site couldnt load. This may be due to a browser
 extension, network issues, or browser settings. Please check your
 connection, disable any ad blockers, or try using a diffe… [+12 chars]",2025-10-04T07:03:09Z,https://pypi.org/project/html4vision/0.6.1/,Pypi.org,Computer Vision,2025-10-04
"A Customer At Her Book Store Got Too Close For Comfort And Poked Her With A Book, So She Got Him Out Of There Immediately",People really need to mind their manners when they're out in public...,"Shutterstock/Reddit
Some people just dont understand the concept of personal space
And this woman knows all about it!
Check out why she got pretty annoyed with a customer at the bookstore where sh… [+4140 chars]",2025-10-04T05:55:31Z,http://twistedsifter.com/2025/10/a-customer-at-her-book-store-got-too-close-for-comfort-and-poked-her-with-a-book-so-she-got-him-out-of-there-immediately/,Twistedsifter.com,Computer Vision,2025-10-04
Promising Artificial Intelligence Stocks To Follow Today – October 2nd,"SoundHound AI, Tempus AI, and BigBear.ai are the three Artificial Intelligence stocks to watch today, according to MarketBeat’s stock screener tool. Artificial intelligence stocks are shares of publicly traded companies that develop, produce or integrate AI t…","SoundHound AI, Tempus AI, and BigBear.ai are the three Artificial Intelligence stocks to watch today, according to MarketBeat’s stock screener tool. Artificial intelligence stocks are shares of publi… [+2520 chars]",2025-10-04T05:03:19Z,https://www.etfdailynews.com/2025/10/04/promising-artificial-intelligence-stocks-to-follow-today-october-2nd/,ETF Daily News,Computer Vision,2025-10-04
HTML4Vision 0.6.0,A simple HTML visualization tool for computer vision research,"A required part of this site couldnt load. This may be due to a browser
 extension, network issues, or browser settings. Please check your
 connection, disable any ad blockers, or try using a diffe… [+12 chars]",2025-10-04T03:21:05Z,https://pypi.org/project/html4vision/0.6.0/,Pypi.org,Computer Vision,2025-10-04
AI is burning out workers instead of helping them,"A new white paper from the University of Phoenix argues that AI adoption in the workplace is fueling burnout instead of easing it. Written by Dr. Jessica Sylvester, Reinventing Productivity: Aligning AI Innovation with Human Potential in the Modern Workforce …","A new white paper from the University of Phoenix argues that AI adoption in the workplace is fueling burnout instead of easing it. Written by Dr. Jessica Sylvester, Reinventing Productivity: Aligning… [+832 chars]",2025-10-04T13:12:36Z,https://slashdot.org/submission/17341110/ai-is-burning-out-workers-instead-of-helping-them,Slashdot.org,AI Ethics,2025-10-04
"National Journalist Association vital for RI, minister says",Communication and Digital Affairs Minister Meutya Hafid stressed the vital role of the National Journalist Association (PWI) for Indonesia&#39;s press at ...,Solo (ANTARA) - Communication and Digital Affairs Minister Meutya Hafid stressed the vital role of the National Journalist Association (PWI) for Indonesia's press at PWI's management board inaugurati… [+3029 chars],2025-10-04T11:52:24Z,https://en.antaranews.com/news/384177/national-journalist-association-vital-for-ri-minister-says,Antaranews.com,AI Ethics,2025-10-04
Inside The Starmer-Modi Mumbai Fintech Summit And Why Some Are Saying It Is Set To 'Transform' Tech,"Starmer and Modi eye quantum pacts and AI finance. With UPI's 20B txns and £6B investments, why this summit could revolutionise UK-India tech ties","Prime Ministers Keir Starmer and Narendra Modi will converge at the Global Fintech Fest 2025 in Mumbai on 9 October 2025, igniting hopes for a UK-India tech revolution amid soaring bilateral trade am… [+5036 chars]",2025-10-04T11:28:37Z,https://www.ibtimes.com/inside-starmer-modi-mumbai-fintech-summit-why-some-are-saying-it-set-transform-tech-3785550,International Business Times,AI Ethics,2025-10-04
AI voices are now indistinguishable from real human voices,Do you think you'd be able to tell the difference between a real human voice and a deepfake? Most people can't.,"Most of us have likely experienced artificial intelligence
 (AI) voices through personal assistants like Siri or Alexa, with their flat intonation and mechanical delivery giving us the impression th… [+3982 chars]",2025-10-04T11:00:00Z,https://www.livescience.com/technology/artificial-intelligence/ai-voices-are-now-indistinguishable-from-real-human-voices,Live Science,AI Ethics,2025-10-04
This is your doctor on ChatGPT,Over a dozen healthcare professionals told Business Insider how they use AI — including one way it could help cure their burnout.,"St. Luke's internal medicine physician Carl Dirks said that ambient listening was a solution for ""clinician burnout.""Chase Castor for BI
Adam Rodman uses ChatGPT when he's stumped.The internal medic… [+10465 chars]",2025-10-04T09:36:01Z,https://www.businessinsider.com/how-doctors-use-ai-chatgpt-including-to-help-avoid-burnout-2025-10,Business Insider,AI Ethics,2025-10-04
"'Alien: Earth' predicts a transhumanist future, but could we ever digitize human consciousness? We asked the experts (exclusive)","Alien: Earth suggests a future where consciousness isn't confined to the body you're born in, but is this a realistic possibility, or merely science fiction? We spoke to experts to find out.","Much like the Xenomorph's life cycle
, the ""Alien"" franchise
 continues to burgeon with the latest instalment, ""Alien: Earth,"" which takes events to 2120 – two years before Ellen Ripley and the doo… [+6869 chars]",2025-10-03T20:00:00Z,https://www.space.com/entertainment/space-movies-shows/alien-earth-predicts-a-transhumanist-future-but-could-we-ever-digitize-human-consciousness-we-asked-the-experts-exclusive,Space.com,AI Ethics,2025-10-03
Health In Tech and AlphaTON Capital Sign Strategic Letter of Intent to Develop HITChain,"--Health In Tech, an Insurtech platform company backed by third-party AI technology, today announced the signing of a non-binding strategic Letter of Intent with AlphaTON Capital Corp., a publicly traded digital asset treasury and blockchain infrastructure co…","an innovative blockchain- powered healthcare insurance claims processing platform built on The Open Network (TON).
STUART, Fla., Sept. 30, 2025 /PRNewswire/ -- Health In Tech (Nasdaq: HIT), an Insur… [+7358 chars]",2025-10-03T17:27:15Z,https://www.nasdaq.com/press-release/health-tech-and-alphaton-capital-sign-strategic-letter-intent-develop-hitchain-2025,Nasdaq,AI Ethics,2025-10-03
"Democrats accuse White House of playing politics with shutdown messaging, cancelled projects","U.S. senators were headed back to the Capitol for another vote on government funding on the third day of a partial shutdown, but there has been no sign of any real progress toward ending their standoff. Republicans, meanwhile, are trolling and blaming Democra…","U.S. senators were headed back to the Capitol for another vote on government funding on the third day of a partial shutdown, but there has been no sign of any real progress toward ending their stando… [+6121 chars]",2025-10-03T14:29:20Z,https://www.cbc.ca/news/world/us-shutdown-3rd-day-1.7650160,CBC News,AI Ethics,2025-10-03
Why Artificial Intelligence Might Become Essential For Job Security,"Advancements in AI have taken the world by storm in recent times, sparking fears about job loss. In reality, embracing AI is the key to protecting your career.","The impact of AI on today's job market is evident. AI tools are becoming more capable and widespread, and the roles that rely on repetitive, rules-based tasks are especially under pressure. Jobs in d… [+1666 chars]",2025-10-03T14:17:00Z,https://www.bgr.com/1982669/is-artificial-intelligence-essential-job-security/,BGR,AI Ethics,2025-10-03
Why Fears of a Trillion-Dollar AI Bubble Are Growing,"Tech firms are spending hundreds of billions of dollars on advanced chips and data centers, not just to keep pace with a surge in the use of chatbots such as...","Construction of the first Stargate AI data center, in Abilene, Texas.Photographer: Kyle Grillot/Bloomberg
The concerns have followed Nvidia, to varying degrees, for much of the boom. The dominant ma… [+13188 chars]",2025-10-04T13:00:08Z,https://finance.yahoo.com/news/why-fears-trillion-dollar-ai-130008034.html,Yahoo Entertainment,Chatbots,2025-10-04
Former OpenAI Employee Horrified by How ChatGPT Is Driving Users Into Psychosis,"""Believe me when I say: the things that ChatGPT has been telling users are probably worse than you think.""
The post Former OpenAI Employee Horrified by How ChatGPT Is Driving Users Into Psychosis appeared first on Futurism.",A former OpenAI safety researcher is horrified with how ChatGPT keeps causing disturbing episode of “AI psychosis” the term that psychiatrists are using to describe mental health crises where users o… [+4606 chars],2025-10-04T13:00:00Z,https://futurism.com/artificial-intelligence/former-openai-employee-horrified-chatgpt-psychosis,Futurism,Chatbots,2025-10-04
"[FREE EBOOKS] OpenAI API Cookbook, Generative AI with Python and PyTorch & Four More Best Selling Titles","Hello fellow geeks, Fresh offers await you on our Information Technology Research Library, please have a look! OpenAI API Cookbook: Build intelligent applications including chatbots, virtual assistants, and content generators ($27.99 Value) FREE for a Limited…","An in-depth, research-backed exploration of the answers to worker motivation. Based on an extensive global research program conducted in nineteen countries around the world surveying over forty-eight… [+1370 chars]",2025-10-04T10:30:30Z,https://www.javacodegeeks.com/2025/10/free-ebooks-openai-api-cookbook-generative-ai-with-python-and-pytorch-four-more-best-selling-titles.html,Javacodegeeks.com,Chatbots,2025-10-04
Weekend Reading: Smarter spam,What caught my eye this week. Working at the end of the age of publishing words has given me a lead on the post-LLM era. I saw early on how ChatGPT had mined the web for everything ever written – well-enough to spit out answers about anything. And as a writer…,"What caught my eye this week.
Working at the end of the age of publishing words has given me a lead on the post-LLM era.
I saw early on how ChatGPT had mined the web for everything ever written wel… [+9072 chars]",2025-10-04T10:03:35Z,https://monevator.com/weekend-reading-smarter-spam/,Monevator.com,Chatbots,2025-10-04
Investors question Reddit's AI gamble,To surrender a social platform as training material is one way to survive the AI transition.,"This is The Takeaway from today's Morning Brief, which you can sign up to receive in your inbox every morning along with:
<ul><li>What we're watching
</li><li>What we're reading
</li><li>Economic … [+2551 chars]",2025-10-04T10:00:03Z,https://finance.yahoo.com/news/investors-question-reddits-ai-gamble-100003910.html,Yahoo Entertainment,Chatbots,2025-10-04
Local Marketing Plus SEO Introduces Advanced AI Marketing Platform for Trades and Service Businesses,"Kelowna, BC October 03, 2025 - PRESSADVANTAGE - Local Marketing Plus SEO, a digital marketing agency based in Kelowna, British Columbia, has announced the launch of comprehensive AI-powered...","Kelowna, BC October 03, 2025 - PRESSADVANTAGE - 
Local Marketing Plus SEO, a digital marketing agency based in Kelowna, British Columbia, has announced the launch of comprehensive AI-powered marketi… [+3921 chars]",2025-10-04T09:56:41Z,https://central.newschannelnebraska.com/story/53135221/local-marketing-plus-seo-introduces-advanced-ai-marketing-platform-for-trades-and-service-businesses,Newschannelnebraska.com,Chatbots,2025-10-04
The head of Instagram swears the app isn't listening to you. But here's what it is doing.,"Adam Mosseri, head of Instagram, posted a ""myth busting"" video about how the platform doesn't listen to you, but instead relies on other factors.","Instagram, an app that used to be for posting photos.Klaudia Radecka/NurPhoto via Getty Images
<ul><li>Instagram users have been concerned that the app listens to conversations to serve targeted ads… [+3638 chars]",2025-10-04T08:44:01Z,https://www.businessinsider.com/does-instagram-listen-to-conversations-adam-mosseri-targeted-ads-2025-10,Business Insider,Chatbots,2025-10-04
The unsettling truth: AI is dangerously good at pretending to understand how you feel,A very real fear is that AI can be used or taught to manipulate users based on their emotional reading.,"In my one year of using AI for everyday tasks, I can recall many instances when Ive felt that a chat assistant seemed to understand exactly how I felt. This has happened practically every time Ive be… [+4661 chars]",2025-10-04T01:30:01Z,https://www.livemint.com/opinion/columns/ai-understands-feelings-manipulation-privacy-risks-digital-empathy-artificial-intelligence-emotions-deception-user-data-11759420809128.html,Livemint,Chatbots,2025-10-04
These little robots literally walk on water,"HydroSpread, a breakthrough fabrication method, lets scientists build ultrathin soft robots directly on water. These tiny, insect-inspired machines could transform robotics, healthcare, and environmental monitoring.","Imagine a tiny robot, no bigger than a leaf, gliding across a pond's surface like a water strider. One day, devices like this could track pollutants, collect water samples or scout flooded areas too … [+3154 chars]",2025-10-04T14:26:35Z,https://www.sciencedaily.com/releases/2025/10/251003033930.htm,Science Daily,Robotics,2025-10-04
Legal threats are pushing Trump's tariff strategy in new directions. Don't expect more certainty.,"The Supreme Court won’t consider the fate of President Trump’s blanket tariffs until November, but the White House already appears to be making adjustments...","The Supreme Court wont consider the fate of President Trumps blanket tariffs until November, but the White House already appears to be making adjustments that could keep as many duties as possible in… [+6163 chars]",2025-10-04T13:00:45Z,https://finance.yahoo.com/news/legal-threats-are-pushing-trumps-tariff-strategy-in-new-directions-dont-expect-more-certainty-130045707.html,Yahoo Entertainment,Robotics,2025-10-04
From Earth to orbit: Jeff Bezos outlines bold vision for space-based data centres,Jeff Bezos projects space data centres within two decades. These facilities will operate with energy efficiency and reliability. They will use constant solar power. Bezos sees this as a next step for space infrastructure. Orbital centres will support the comp…,"Amazon founder and executive chair Jeff Bezos has projected that data centres could be built in space within the next 10 to 20 years. Speaking at the Italian Tech Week in Turin, he stated that space-… [+3124 chars]",2025-10-04T12:15:20Z,https://economictimes.indiatimes.com/news/new-updates/from-earth-to-orbit-jeff-bezos-outlines-bold-vision-for-space-based-data-centres/articleshow/124307397.cms,The Times of India,Robotics,2025-10-04
10 Weekend Reads,"The weekend is here! Pour yourself a mug of Colombia Tolima Los Brasiles Peaberry Organic coffee, grab a seat outside, and get ready for our longer-form weekend reads: • The Mysterious Billionaire Boss at Jane Street Smashing Trading Records: The firm’s secre…","The Mysterious Billionaire Boss at Jane Street Smashing Trading Records: The firms secrecy-loving co-founder is raking in money faster than he can spend it on Burning Man, his own casino and, unwitti… [+2260 chars]",2025-10-04T10:30:44Z,https://ritholtz.com/2025/10/10-weekend-reads-60/,Ritholtz.com,Robotics,2025-10-04
"AOL's dial-up internet service killed with a final modem screech after 34 years — America Online goes offline this week, but other dial-up services still exist","But there are other dial-up ISP still around, and you can still use your modem for BBS access, or its fax functionality.","A few weeks ago, we warned that a ‘routine evaluation’ of its business had triggered AOL’s decision to discontinue its 34-years established dial-up internet service. The fateful day came and went thi… [+2955 chars]",2025-10-04T10:22:38Z,https://www.tomshardware.com/service-providers/network-providers/aols-dial-up-internet-service-killed-with-a-final-modem-screech-this-week-after-34-years-america-online-goes-offline-but-other-dual-up-services-still-exist,Tom's Hardware UK,Robotics,2025-10-04
"China is starting to talk about AI superintelligence, and some in the U.S. are taking notice","Alibaba announced a new initiative aiming to reach AI superintelligence, heating up an arms race with American AI companies.","Early last week in the Chinese tech hub of Hangzhou, a slick, larger-than-life video screen beamed out four words that would drive tech giant Alibabas stock to historic levels and signal a shift in C… [+6688 chars]",2025-10-04T10:00:00Z,https://www.nbcnews.com/tech/tech-news/china-starting-talk-ai-superintelligence-us-are-taking-notice-rcna234675,NBC News,Robotics,2025-10-04
Best Robotics Stocks Worth Watching – October 2nd,"Teradyne, Richtech Robotics, Serve Robotics, Ouster, and PROCEPT BioRobotics are the five Robotics stocks to watch today, according to MarketBeat’s stock screener tool. Robotics stocks represent shares of publicly traded companies that design, manufacture or …","Teradyne, Richtech Robotics, Serve Robotics, Ouster, and PROCEPT BioRobotics are the five Robotics stocks to watch today, according to MarketBeat’s stock screener tool. Robotics stocks represent shar… [+2961 chars]",2025-10-04T08:10:52Z,https://www.etfdailynews.com/2025/10/04/best-robotics-stocks-worth-watching-october-2nd/,ETF Daily News,Robotics,2025-10-04
